{
  "assurance_ceilings": {
    "artifact_flags": [
      "content_addressed",
      "reproducible_built",
      "authenticated",
      "transparency_logged"
    ],
    "implementation_order": [
      "unknown",
      "directly-trusted",
      "campaign-tested",
      "independently-recomputed",
      "checker-derived",
      "source-native-refined"
    ],
    "input_provenance_order": [
      "unknown",
      "supplied",
      "integrity-bound",
      "observed",
      "authenticated-source",
      "measured"
    ],
    "mathematical_order": [
      "refused",
      "indeterminate",
      "estimated",
      "model-based",
      "checked",
      "bounded",
      "formal-bounded",
      "exact"
    ],
    "mathematical_ranks": {
      "bounded": 4,
      "checked": 3,
      "estimated": 2,
      "exact": 6,
      "formal-bounded": 5,
      "indeterminate": 1,
      "model-based": 2,
      "refused": 0
    },
    "model_identity": "not-applicable",
    "model_validity_order": [
      "unknown",
      "assumed",
      "calibrated",
      "empirically-validated"
    ],
    "never_granted_implementation": [
      "source-native-refined"
    ],
    "producer_emittable_provenance": [
      "integrity-bound",
      "supplied",
      "unknown"
    ]
  },
  "bundle_admissibility": {
    "admitted_contexts": [
      "current-v1.7.2-range-rational",
      "archival-v1.5.0-range-rational",
      "gaussian-v1.5.0",
      "current-v1.7.2-int-cert-request-bound"
    ],
    "revoked_checker_present_in_repo": false,
    "revoked_checker_sha256": "c858e3bfc0ff2809a808170caabbf090077cb54996e76f065dbcd26ffb067d49",
    "revoked_lanes": [
      "int-cert-v1.7.0-request-unbound"
    ]
  },
  "coverage_inventory": {
    "formal_fragment": [
      "abs",
      "add",
      "atan",
      "ceil",
      "cos",
      "div",
      "exp",
      "floor",
      "ln",
      "max",
      "min",
      "mul",
      "neg",
      "num",
      "pow",
      "round",
      "sin",
      "sqrt",
      "sub",
      "trunc",
      "var"
    ],
    "refused_from_formal": [
      "acos",
      "asin",
      "atan2",
      "cbrt",
      "const",
      "hypot",
      "log10",
      "log2",
      "mod",
      "pow_general",
      "pow_neg",
      "tan"
    ],
    "rows": 72,
    "sha256": "6373641cd7833bb46a08f44acf683a119e0a637c8acb88d22797b81188d896b6"
  },
  "docs": {
    "README.md": true,
    "plugin/hermes/tools.json": true,
    "release/claim/SPEC.md": true
  },
  "epochs": {
    "claim_release_epoch": "v1.6.0",
    "schemas": {
      "bundle": "jackal-claim-bundle-v1",
      "machine": "jackal-machine-int-cert-v1",
      "node": "jackal-claim-node-v1",
      "policy": "jackal-claim-policy-v1"
    }
  },
  "packs": [],
  "platform": {
    "arch": "arm64",
    "os": "Darwin"
  },
  "profiles": [],
  "refusal_vocabulary": {
    "claim_bundle_verify": [
      "artifact-upgrade",
      "assurance-launder",
      "assurance-schema",
      "bundle-budget",
      "bundle-fields",
      "bundle-json",
      "bundle-schema",
      "consequence-floor",
      "digest-mismatch",
      "duplicate-key",
      "environment-mismatch",
      "epoch-mismatch",
      "evidence-encoding",
      "evidence-hash-mismatch",
      "evidence-kind",
      "evidence-producer-untrusted",
      "evidence-prop-mismatch",
      "evidence-verify-failed",
      "float-forbidden",
      "freshness-expired",
      "freshness-schema",
      "freshness-stale",
      "graph-cycle",
      "implementation-upgrade",
      "int-budget",
      "interval-div-zero",
      "interval-endpoints",
      "legacy-dispatch-failed",
      "legacy-verifier-unavailable",
      "machine-cert-invalid",
      "machine-overflow-claim",
      "machine-shift-range",
      "machine-width",
      "model-upgrade",
      "node-duplicate-id",
      "node-fields",
      "node-id-mismatch",
      "node-schema",
      "nonce-mismatch",
      "nonce-missing",
      "orphan-node",
      "parent-duplicate",
      "parent-missing",
      "parent-order",
      "policy-pin-mismatch",
      "policy-schema",
      "policy-violation",
      "prop-budget",
      "prop-schema",
      "provenance-upgrade",
      "rat-not-canonical",
      "receipt-context-unsupported",
      "registry-inference-mismatch",
      "registry-semantics-mismatch",
      "registry-unit-mismatch",
      "render-mismatch",
      "residual-missing",
      "root-missing",
      "root-proposition-mismatch",
      "rule-arity",
      "rule-invalid",
      "rule-params",
      "rule-unknown",
      "string-budget",
      "threshold-not-established",
      "unicode-forbidden",
      "unit-affine-forbidden",
      "unit-alias-forbidden",
      "unit-dim-mismatch",
      "unit-unknown",
      "unknown-field",
      "verifier-internal"
    ],
    "exact_verify": [
      "cert-json",
      "cert-schema",
      "composite-invalid",
      "crt-invalid",
      "int-budget",
      "int-malformed",
      "mod-inv-invalid",
      "mod-pow-invalid",
      "poly-budget",
      "poly-canon-mismatch",
      "poly-eq-mismatch",
      "poly-fragment",
      "poly-gcd-mismatch",
      "pratt-budget",
      "pratt-missing-subcert",
      "prime-invalid",
      "rat-not-canonical",
      "ratfunc-canon-mismatch",
      "ratfunc-zero-den",
      "roots-invalid",
      "verifier-internal",
      "xgcd-invalid"
    ]
  },
  "schema": "jackal-capabilities-v1",
  "skills": [
    "plugins/jackel/skills/jackel/SKILL.md"
  ],
  "tools": {
    "count": 34,
    "names": [
      "jackal_alg_cmp",
      "jackal_alg_sign",
      "jackal_atan_rat_bound",
      "jackal_canon",
      "jackal_claim",
      "jackal_cos_rat_bound",
      "jackal_crt",
      "jackal_diff",
      "jackal_divides",
      "jackal_evaluate",
      "jackal_exact",
      "jackal_exp_rat_bound",
      "jackal_gaussian_integral",
      "jackal_integrate",
      "jackal_integrate_adaptive",
      "jackal_integrate_bound",
      "jackal_integrate_bound_cert",
      "jackal_ln_rat_bound",
      "jackal_mod_inv",
      "jackal_mod_pow",
      "jackal_poly_canon",
      "jackal_poly_eq",
      "jackal_poly_gcd",
      "jackal_prime_cert",
      "jackal_range_bound",
      "jackal_ratfunc_canon",
      "jackal_roots_isolate",
      "jackal_sin_rat_bound",
      "jackal_solve",
      "jackal_sqrt_rat_bound",
      "jackal_tanh_rat_bound",
      "jackal_verify_bundle",
      "jackal_verify_receipt",
      "jackal_xgcd"
    ]
  }
}
